family_name,family_class,transformation_type,mechanism_type,reactant_pattern_text,product_pattern_text,key_reagents_clue,common_solvents,common_conditions,synonym_names,description_short,overview_count,application_count,mechanism_count
Shi Asymmetric Epoxidation,named_reaction,enantioselective dioxirane epoxidation of unfunctionalized alkenes,ketone-catalyzed Oxone oxidation via chiral dioxirane oxygen transfer,alkene substrate + ketone catalyst + Oxone/KHSO5,enantioenriched epoxide,Shi catalyst|Oxone|KHSO5|Na2EDTA,CH3CN/H2O|buffered aqueous media,"pH-controlled buffered oxidation, often 0–25 °C with fructose-derived ketone catalyst",Shi epoxidation,Chiral ketone-catalyzed epoxidation that uses Oxone-generated dioxiranes to furnish enantioenriched epoxides from alkenes.,1,1,1
Simmons-Smith Cyclopropanation,named_reaction,methylene cyclopropanation of alkenes,concerted zinc carbenoid transfer of CH2 to alkenes,alkene + zinc carbenoid precursor,cyclopropane,Simmons-Smith|CH2I2|Zn-Cu|Et2Zn,ether|DCM|benzene|toluene,"zinc carbenoid generation from CH2I2 with Zn-Cu or Et2Zn, often low temperature to room temperature",Simmons-Smith Reaction|Simmons-Smith cyclopropanation,Cyclopropanation of alkenes by zinc carbenoid methylene transfer with strong stereospecificity and useful allylic-alcohol direction.,1,1,1
Skraup and Doebner-Miller Quinoline Synthesis,named_reaction,acidic oxidative annulation to quinolines,acid-catalyzed condensation/cyclization followed by oxidation,"aniline + glycerol or α,β-unsaturated carbonyl compound",quinoline derivative,Skraup|Doebner-Miller|As2O5|H3AsO4|H3PO4,conc. H2SO4|HCl-ZnCl2|AcOH,strongly acidic oxidative conditions with heating,Skraup synthesis|Doebner-Miller synthesis,Classical quinoline-forming annulations of anilines with glycerol or enals/enones under acidic oxidative conditions.,1,1,1
Smiles Rearrangement,named_reaction,intramolecular aryl migration by nucleophilic aromatic substitution,base-promoted intramolecular SNAr through a five-membered transition state,activated diaryl ether/sulfide/sulfone or related biaryl substrate,rearranged biaryl or heterobiaryl product,Smiles rearrangement|Smiles-Truce|LiHMDS|DMSO,DMSO|THF,strong base or thermal conditions depending on substrate activation,Smiles-Truce rearrangement,Intramolecular rearrangement in which an anionic nucleophile attacks an activated aryl ring ipso-position to transfer the aryl group.,1,1,1
Smith-Tietze Multicomponent Dithiane Linchpin Coupling,named_reaction,multicomponent epoxide-dithiane linchpin coupling,"epoxide opening followed by solvent-controlled [1,4]-Brook rearrangement","lithiated 2-silylated-1,3-dithiane + epoxide(s)","1,5-polyol fragment or advanced polyoxygenated coupling product",Smith-Tietze|HMPA|DMPU|Brook rearrangement|TBSCI,THF|Et2O,"low-temperature lithiation and epoxide opening followed by Brook rearrangement, sometimes HMPA or DMPU mediated",Smith-Tietze coupling,"A multicomponent linchpin process using silylated dithianes and epoxides to build symmetrical or unsymmetrical 1,5-polyol fragments.",1,1,1
