family_name,family_class,transformation_type,mechanism_type,key_reagents_clue,common_solvents,common_conditions,synonym_names,description_short
Criegee Oxidation,named_reaction,vicinal diol oxidative cleavage to carbonyl fragments,lead tetraacetate-mediated glycol cleavage via cyclic lead intermediates,vicinal diol|Pb(OAc)4|lead tetraacetate|carbonyl cleavage,benzene|organic solvent|MeOH,treat vicinal diols with lead tetraacetate under anhydrous conditions to cleave the C-C bond and form carbonyl compounds,Criegee oxidation|lead tetraacetate glycol cleavage,"Oxidative cleavage of vicinal diols to carbonyl compounds using lead tetraacetate, often as a mild alternative for advanced cyclic diol fragmentation."
Curtius Rearrangement,named_reaction,carboxylic acid derivative to isocyanate then amine / urea / carbamate,thermal acyl azide rearrangement with nitrogen extrusion to isocyanate,carboxylic acid|acyl azide|DPPA|TMSN3|isocyanate,toluene|benzene|water|alcohol solvent,"generate acyl azide from acid derivative, heat to rearrange to isocyanate, then trap with water, amine, or alcohol",Curtius rearrangement|acyl azide rearrangement,"Thermal rearrangement of acyl azides to isocyanates, enabling conversion of carboxylic acids into amines, ureas, and carbamates."
Dakin Oxidation,named_reaction,activated aromatic aldehyde or ketone to substituted phenol,"hydroperoxide addition followed by 1,2-aryl shift and hydrolysis of O-acylphenol",o-hydroxy aldehyde|p-hydroxy ketone|H2O2|NaOH|phenol,aqueous base|CH2Cl2|organic peroxide medium,"treat activated aromatic aldehydes or ketones with hydrogen peroxide or peracid, then hydrolyze the O-acylphenol intermediate to phenol",Dakin oxidation|modified Dakin oxidation,Oxidation/rearrangement of activated aromatic aldehydes or ketones to substituted phenols through peroxide addition and aryl migration.
Dakin-West Reaction,named_reaction,alpha-amino acid to alpha-acylamino ketone,"anhydride-mediated N-acylation, oxazolone formation, decarboxylative acyl transfer",alpha-amino acid|anhydride|Ac2O|base|alpha-acylamino ketone,pyridine|Et3N|THF,treat alpha-amino acids with anhydride and base to form mixed anhydride/oxazolone intermediates that collapse to alpha-acylamino ketones,Dakin-West reaction|Dakin West reaction,Transformation of alpha-amino acids into alpha-acylamino ketones under anhydride/base conditions through mixed anhydride and oxazolone intermediates.
Danheiser Benzannulation,named_reaction,cyclobutenone or diazoketone annulation with activated alkyne to substituted arene,vinylketene generation followed by cycloaddition and electrocyclic rearrangement,cyclobutenone|alpha-diazoketone|activated alkyne|vinylketene|benzannulation,CHCl3|benzene|toluene|THF,heat cyclobutenones or generate vinylketenes from diazoketones in the presence of activated heterosubstituted alkynes to forge substituted aromatic rings,Danheiser benzannulation|modified Danheiser benzannulation,Annulation method that converts cyclobutenone- or diazoketone-derived vinylketenes and activated alkynes into densely substituted aromatic rings.
