family_name,family_class,transformation_type,mechanism_type,reactant_pattern_text,product_pattern_text,key_reagents_clue,common_solvents,common_conditions,synonym_names,description_short,overview_count,application_count,mechanism_count
Prévost Reaction,named_reaction,anti dihydroxylation of alkenes via halonium opening and carboxylate displacement,iodonium-ion formation followed by double carboxylate substitution and hydrolysis,alkene + iodine + silver carboxylate under anhydrous or partially hydrated conditions,"trans-1,2-diol or cis-1,2-diol depending on Prévost versus Woodward-Brutcher conditions",Prévost|Woodward-Brutcher|I2|silver benzoate|silver acetate|PhCO2Ag|AgOAc,benzene|AcOH|water,dry conditions favor trans diols while added water or acetic acid in the Woodward-Brutcher modification favors cis-diols,Woodward-Brutcher modification,"Classical vicinal dihydroxylation manifold that uses iodine and silver carboxylates to convert alkenes into stereodefined 1,2-diols under either dry or wet conditions.",1,1,1
Prilezhaev Reaction,named_reaction,peroxyacid epoxidation of alkenes,concerted syn oxygen transfer from a peroxyacid to an alkene,alkene + peroxyacid such as mCPBA,epoxide retaining the alkene geometry,Prilezhaev|epoxidation|mCPBA|peroxyacid|epoxide,CH2Cl2|CHCl3|benzene,usually run at low to ambient temperature in nonprotic solvent with buffering additives when acid-sensitive products are present,peroxyacid epoxidation,Foundational alkene epoxidation method in which a peroxyacid delivers oxygen in a stereospecific syn process to give epoxides from isolated double bonds.,1,1,1
Prins Reaction,named_reaction,acid-catalyzed coupling of alkenes with aldehydes to form oxocarbenium-derived oxygen heterocycles and alcohols,protonated aldehyde addition to alkene followed by carbocation capture or elimination,alkene + aldehyde under protic or Lewis acid conditions,"allylic alcohol, 3-substituted alcohol, 1,3-diol, or 1,3-dioxane",Prins|aldehyde|alkene|BF3·OEt2|SnBr4|Me2AlCl,DCM|AcOH|benzene,acid activates the aldehyde to an oxocarbenium precursor and product class depends on nucleophile availability and ring-closing opportunity,carbonyl ene-Prins reaction,"Versatile acid-promoted alkene–aldehyde coupling that channels oxocarbenium chemistry into tetrahydropyrans, 1,3-dioxanes, allylic alcohols, and related oxygenated products.",1,1,1
Prins-Pinacol Rearrangement,named_reaction,tandem Prins cyclization and pinacol rearrangement to build tetrahydrofuran frameworks,"oxocarbenium formation followed by cyclization and carbocationic [1,2]-shift","allylic 1,2-diol or allylic acetal + aldehyde or ketone under Lewis acid activation","highly substituted tetrahydrofuran, annulated 3-acyl tetrahydrofuran, or cyclopentanone-annulated product",Prins-pinacol|SnCl4|BF3|allylic acetal|tetrahydrofuran annulation,CH2Cl2|acetone,typically low-temperature Lewis-acid activation of an acetal or allylic diol followed by tandem cyclization and rearrangement,tandem Prins/pinacol rearrangement,Powerful tandem cationic cascade that merges Prins cyclization with pinacol rearrangement to forge densely substituted tetrahydrofuran and annulated ring systems.,1,1,1
Pummerer Rearrangement,named_reaction,activation of sulfoxides to α-functionalized sulfides or carbonyl-equivalent products,"acylsulfonium formation, sulfur-stabilized cation generation, and nucleophile capture",sulfoxide activated by acylating or silylating reagent in the presence of nucleophile,"α-substituted sulfide, vinyl sulfide, aldehyde, or carbonyl/thiol pair after hydrolysis",Pummerer|sulfoxide|Ac2O|TFAA|TMSOTf|sila-Pummerer|vinylogous Pummerer,CH2Cl2|benzene|ethyl acetate,"often uses acetic anhydride, trifluoroacetic anhydride, or silyl triflates with optional acid/base co-catalysis to generate sulfur-substituted cationic intermediates",sila-Pummerer rearrangement|vinylogous Pummerer rearrangement,"General sulfoxide activation strategy that converts sulfoxides into electrophilic sulfur-stabilized intermediates and enables α-functionalization, rearrangement, and carbonyl generation.",1,1,1
