family_name,family_class,transformation_type,mechanism_type,reactant_pattern_text,product_pattern_text,key_reagents_clue,common_solvents,common_conditions,synonym_names,description_short,overview_count,application_count,mechanism_count
Benzilic Acid Rearrangement,named_reaction,"1,2-rearrangement / ring contraction","nucleophilic addition followed by 1,2-shift",acyclic or cyclic alpha-diketone under basic conditions,alpha-hydroxy carboxylic acid salt or ring-contracted alpha-hydroxy acid,"NaOH, alkoxides, amide bases, hydroxide attack on diketones","aqueous alcohols, methanol, basic media",base-promoted rearrangement; protonation on workup,benzilic acid rearrangement; retro-benzilic acid rearrangement,Base-induced rearrangement of alpha-diketones to alpha-hydroxy acid derivatives with migratory ring contraction variants.,1,1,1
Benzoin and Retro-Benzoin Condensation,named_reaction,umpolung C-C bond formation / retro-fragmentation,cyanide or thiazolium/NHC catalysis,"aldehydes, glyoxals, or alpha-hydroxy ketones under cyanide or thiazolium catalysis",benzoin products or retro-benzoin cleavage products such as ketones and aldehydes,"KCN, NaCN, thiazolium salts, NHC catalysts, DBU","DMF, THF, alcohols, basic media",cyanide catalysis or thiazolium catalysis with proton-transfer sequence,benzoin condensation; retro-benzoin condensation,Classical umpolung coupling of aldehydes to benzoins and the reverse fragmentation logic used for ketone synthesis.,1,1,1
Bergman Cycloaromatization Reaction,named_reaction,enediyne cycloaromatization,diradical cyclization,enediyne or enediyne-like system,benzenoid diradical trapped to an aromatic product,"heat, cyclohexadiene hydrogen donor, MgCl2, benzene","benzene, methanol, hydrogen-donor media",thermal or metal-induced cycloaromatization of enediynes,Bergman cyclization; Bergman cycloaromatization,Cycloaromatization of enediynes to benzenoid diradicals that rapidly abstract hydrogen atoms and build aromatic frameworks.,1,1,1
Biginelli Reaction,named_reaction,multicomponent heterocycle synthesis,N-acyliminium mediated cyclocondensation,aldehyde + beta-keto ester + urea/thiourea,dihydropyrimidinone or related DHPM heterocycle,"HCl, FeCl3, BF3·OEt2, Yb(OTf)3, urea, thiourea","ethanol, THF, DMF, refluxing alcohols",acid- or Lewis-acid-catalyzed one-pot three-component condensation,Biginelli condensation; DHPM synthesis,"Three-component condensation used to build dihydropyrimidinones from aldehydes, beta-keto esters, and urea derivatives.",1,1,1
Birch Reduction,named_reaction,dissolving-metal dearomatization / reductive alkylation,stepwise electron transfer and protonation,arene or electron-poor heteroarene with alkali metal in liquid ammonia and alcohol,unconjugated cyclohexadiene or reduced heterocycle,"Li or Na, NH3(l), ROH, t-BuOH, EtOH","liquid ammonia, THF co-solvent, alcohol proton sources",low-temperature dissolving-metal reduction; optional Birch reductive alkylation,Birch reduction; Birch reductive alkylation,Dissolving-metal reduction of aromatic rings and heteroarenes to unconjugated dienes or partially reduced heterocycles.,1,1,1
