family_name,family_class,transformation_type,mechanism_type,key_reagents_clue,common_solvents,common_conditions,synonym_names,description_short
Hetero Diels-Alder Cycloaddition,named_reaction,heteroatom-containing Diels-Alder [4+2] cycloaddition,concerted or stepwise cycloaddition between heterodienes/heterodienophiles and pi partners,heterodiene|heterodienophile|HDA reaction|imine|nitroso|inverse electron-demand,benzene|THF|neat|DMF|water,combine a heterodiene or heterodienophile with a diene or alkene under thermal or Lewis-acid conditions to generate oxygen- or nitrogen-containing cyclohexene/cyclohexane adducts,Hetero D-A Cycloaddition|HDA Reaction,Pericyclic or stepwise hetero-[4+2] annulation used to assemble densely functionalized oxygen- and nitrogen-heterocycles.
Hofmann Elimination,named_reaction,exhaustive-methylation-driven beta elimination to alkenes,formation of quaternary ammonium salts followed by base- or heat-induced beta elimination,CH3I|Ag2O|H2O|quaternary ammonium|Hofmann elimination|degradation,MeOH|H2O|THF|toluene,"exhaustively methylate an amine, convert the ammonium salt to the hydroxide, then induce elimination or degradation to form the least substituted alkene",Hofmann Degradation|Hofmann Exhaustive Methylation,Classical degradation of amines through quaternary ammonium salts to reveal or install alkenes with Hofmann selectivity.
Hofmann-Loffler-Freytag Reaction,named_reaction,"remote C-H amination via N-centered radical 1,5-hydrogen abstraction",radical halogen-atom transfer and cyclization from N-haloamines or related N-radical precursors,"N-haloamine|PIDA|PhIO|I2|HLF reaction|1,5-hydrogen abstraction",DCM|EtOH|W-lamp|reflux,"generate an N-centered radical from an N-haloamine or Suarez-type precursor to abstract a remote hydrogen, then cyclize to a saturated nitrogen heterocycle",Hofmann-Loeffler-Freytag Reaction|HLF Reaction|Suarez Modification,"Remote radical amination family that converts linear amines or related precursors into cyclic amines through 1,5-hydrogen abstraction."
Hofmann Rearrangement,named_reaction,amide contraction to amines via isocyanates,N-haloamide formation followed by migration to isocyanate and hydrolysis or trapping,Br2|NaOH|Pb(OAc)4|PhI(OAc)2|isocyanate|Hofmann rearrangement,H2O|MeOH|DMF|pyridine,convert a primary carboxamide into an amine or trapped carbamate/urea derivative via N-haloamide generation and rearrangement to an isocyanate,Hofmann Degradation|Hofmann Amide Rearrangement,One-carbon contraction of primary amides to amines or isocyanate-derived products under hypohalite or hypervalent-iodine conditions.
Horner-Wadsworth-Emmons Olefination,named_reaction,phosphonate-based olefination of aldehydes and ketones,phosphonate carbanion addition followed by oxaphosphetane collapse to alkenes,phosphonate ester|HWE olefination|NaH|aldehyde|E-alkene|Horner-Wittig,THF|benzene|15-crown-5|LiHMDS|NaH,"deprotonate a phosphonate or phosphine oxide derivative and condense it with an aldehyde or ketone to furnish an alkene, often with high E selectivity",HWE Olefination|Wadsworth-Emmons Reaction|Horner-Wittig Reaction,Widely used phosphonate olefination that usually furnishes E-alkenes under milder and more chemoselective conditions than classical Wittig reactions.
