family_name,family_class,transformation_type,mechanism_type,reactant_pattern_text,product_pattern_text,key_reagents_clue,common_solvents,common_conditions,synonym_names,description_short,overview_count,application_count,mechanism_count
Mannich Reaction,named_reaction,aminomethylation of enolizable carbonyls or other CH-acidic partners with formaldehyde and amines,iminium-ion formation followed by carbon–carbon bond formation at the alpha position of an enolizable nucleophile,enolizable carbonyl compound + formaldehyde or other aldehyde + amine,Mannich base|beta-amino carbonyl compound,CH2O|NH4Cl|NH4OAc|TFA|KHMDS|TMSCl,EtOH|MeOH|H2O|AcOH|THF|DMF,"acidic or buffered conditions, sometimes using preformed iminium salts or vinylogous Mannich variants",Mannich reaction|Mannich aminomethylation,Foundational carbon–carbon bond-forming reaction that installs aminomethyl substituents onto enolizable carbonyl systems via iminium intermediates.,1,1,1
McMurry Coupling,named_reaction,low-valent titanium-mediated reductive coupling of carbonyl compounds to alkenes,reductive dimerization or intramolecular coupling through titanium pinacolate-like intermediates followed by deoxygenation,aldehyde or ketone|dicarbonyl substrate,alkene|macrocyclic alkene,TiCl3|TiCl4|Zn|Zn-Cu|LiAlH4|Na,DME|THF|pyridine,low-valent titanium generated in situ from titanium chlorides and reducing metals; intra- and intermolecular olefination,McMurry coupling|McMurry olefination,Reductive olefination method that couples carbonyl compounds under low-valent titanium conditions and is especially powerful for macrocyclization.,1,1,1
Meerwein Arylation,named_reaction,radical arylation of electron-deficient olefins with aryldiazonium salts,single-electron reduction of aryldiazonium salts to aryl radicals followed by radical addition and elimination,substituted aromatic amine + NaNO2/HX -> aryldiazonium salt + activated alkene,aryl-substituted olefin|beta-aryl-alpha-halo derivative,NaNO2|HCl|HBr|CuCl|CuCl2|CuBr2|Cu2O,acetone|acetonitrile|H2O,"in situ diazotization and copper-mediated or thermal radical arylation, often with activated alkenes or dienes",Meerwein arylation,Diazonium-radical coupling strategy for attaching aryl groups across activated double bonds under simple in situ diazotization conditions.,1,1,1
Meerwein-Ponndorf-Verley Reduction,named_reaction,transfer-hydrogen reduction of aldehydes and ketones with aluminum alkoxides,concerted hydride transfer through a six-membered aluminum alkoxide transition state,ketone or aldehyde + secondary alcohol donor,1° or 2° alcohol,Al(i-PrO)3|SmI2,i-PrOH|toluene|xylene,equilibrium transfer-hydrogen reduction often driven by acetone removal or excess donor alcohol,Meerwein-Ponndorf-Verley reduction|MPV reduction,Mild and chemoselective aluminum-alkoxide transfer-hydrogen reduction of carbonyl compounds to alcohols.,1,1,1
Meisenheimer Rearrangement,named_reaction,rearrangement of tertiary amine N-oxides to hydroxylamines or ring-expanded heterocycles,"thermal or oxidative [1,2]- and [2,3]-sigmatropic migration from amine N-oxides",tertiary amine N-oxide,"N,O-disubstituted hydroxylamine|1,2-oxazacycle",mCPBA|H2O2|MMPP|DBU,CHCl3|DCM|THF|H2O,N-oxide formation followed by thermal rearrangement or base-promoted capture; cyclic systems often undergo ring expansion,"Meisenheimer rearrangement|[1,2]-Meisenheimer rearrangement|[2,3]-Meisenheimer rearrangement","Rearrangement manifold of tertiary amine N-oxides that furnishes hydroxylamines or ring-expanded azaheterocycles via [1,2]- or [2,3]-shifts.",1,1,1
