family_name,family_class,transformation_type,mechanism_type,reactant_pattern_text,product_pattern_text,key_reagents_clue,common_solvents,common_conditions,synonym_names,description_short,overview_count,application_count,mechanism_count
Lieben Haloform Reaction,named_reaction,base-promoted halogenation and cleavage of methyl ketones or methyl carbinols to haloforms and carboxylates,sequential alpha-halogenation to trihalomethyl ketones followed by hydrolytic C-C bond cleavage,methyl ketone or methyl carbinol + halogen source + base,haloform|carboxylic acid or carboxylate salt,I2|Br2|NaOCl|NaOBr|NaOH,H2O|dioxane|THF|MeOH,"aqueous or mixed solvent conditions with hypohalite or halogen/base combinations, often followed by acidic workup",Haloform reaction|Lieben haloform reaction,One-carbon degradation method that converts methyl ketones and related methyl carbinols into haloforms and carboxylate products under hypohalite conditions.,1,1,1
Lossen Rearrangement,named_reaction,rearrangement of activated hydroxamic acids to isocyanates and trapped amine/urea/carbamate products,base- or heat-induced migration from O-acyl or O-aryl hydroxamates to isocyanates,O-acyl or O-aryl hydroxamic acid derivative,isocyanate|amine|carbamate|urea,Ac2O|DBU|EDC|H2O,THF|EtOH|H2O,activation of hydroxamic acid followed by heating or base treatment and nucleophilic trapping of the isocyanate,Lossen rearrangement,"Activated-hydroxamate rearrangement that furnishes isocyanates under mild conditions and enables access to amines, carbamates, and ureas after trapping.",1,1,1
Luche Reduction,named_reaction,"CeCl3/NaBH4 reduction of alpha,beta-unsaturated ketones to allylic alcohols","Lewis-acid-assisted 1,2-hydride delivery to enones with suppression of conjugate reduction","alpha,beta-unsaturated ketone + CeCl3 + NaBH4",allylic alcohol,CeCl3·7H2O|NaBH4,methanol|ethanol|isopropanol,low temperature to room temperature in alcohol solvent with CeCl3 and NaBH4,Luche reduction,"Selective 1,2-reduction of enones to allylic alcohols using sodium borohydride in the presence of cerium(III) chloride.",1,1,1
Madelung Indole Synthesis,named_reaction,base-promoted cyclization of N-acyl-o-toluidines or related anilides to indoles,deprotonation alpha to the amide followed by intramolecular cyclization and aromatization; Smith-modified variants use Peterson olefination logic,N-acyl-o-toluidine or related anilide,"2-substituted indole|2,3-disubstituted indole",NaOEt|NaNH2|n-BuLi|KOtBu,hexanes|THF|n-amyl alcohol,high-temperature alkoxide or sodamide conditions or low-temperature Smith-modified organolithium variants,Madelung indole synthesis|Smith indole synthesis|Smith-modified Madelung indole synthesis,"Classical and modified intramolecular anilide cyclization methods for building 2-substituted and 2,3-disubstituted indoles.",1,1,1
Malonic Ester Synthesis,named_reaction,alkylation of malonic esters followed by hydrolysis and decarboxylation to substituted acetic acids,enolate alkylation of malonate esters with electrophiles followed by saponification and decarboxylation,malonic ester + alkyl electrophile,mono- or dialkylated acetic acid|cycloalkane derivative,NaOR|NaH|KOtBu,ROH|t-BuOH|benzene|ether|DMF,base-promoted mono- or dialkylation followed by hydrolysis and heating with acid or base for decarboxylation,Malonic ester synthesis,Foundational active-methylene strategy that converts alkylated malonate esters into substituted acetic acids and related cyclic products.,1,1,1
