page_label,page_no,title,section_name,page_kind,summary,family_names,reference_family_name,notes,image_filename
p496,496,WOLFF-KISHNER REDUCTION,Importance; Mechanism,canonical_overview,"Overview page for the Wolff-Kishner reduction describing hydrazone- or semicarbazone-based deoxygenation of aldehydes and ketones to hydrocarbons under strongly basic, high-temperature conditions, including Huang-Minlon, Cram, and related modifications.",Wolff-Kishner Reduction,Wolff-Kishner Reduction,"Emphasizes hydrazone formation, base-promoted extrusion of nitrogen through dimide-like intermediates, and operational variants that lower temperature or shorten reaction time.",named reactions_548.jpg
p497,497,WOLFF-KISHNER REDUCTION,Synthetic Applications,application_example,"Application page for the Wolff-Kishner reduction featuring ketone deoxygenation in the syntheses of methyl kaurene and trachylobane derivatives, aspidospermidine, dysidiolide, and steroidal frameworks under classical or modified hydrazone reduction conditions.",Wolff-Kishner Reduction,Wolff-Kishner Reduction,"Examples show late-stage carbonyl removal in densely functionalized polycycles, including Myers-type one-pot variants and combinations with lactam reduction or protecting-group manipulations.",named reactions_549.jpg
p498,498,WURTZ COUPLING,Importance; Mechanism,canonical_overview,"Overview page for the Wurtz coupling describing sodium- or metal-mediated coupling of alkyl, allylic, benzylic, or aryl halides to form new carbon-carbon bonds, including homocoupling, cross-coupling, and Wurtz-Fittig variants.",Wurtz Coupling,Wurtz Coupling,"Covers classical sodium-promoted dimerization, limits from elimination and rearrangement, modified protocols using solubilizing additives such as tetraphenylethylene, and mechanistic proposals involving organosodium or radical pathways.",named reactions_550.jpg
p499,499,WURTZ COUPLING,Synthetic Applications,application_example,"Application page for the Wurtz coupling highlighting formation of steroid dimers, macrocycles such as garugamblin-1 and marchantin I, and cyclobutanes from dibromide precursors under classical or modified sodium-mediated coupling conditions.",Wurtz Coupling,Wurtz Coupling,"Examples emphasize intramolecular reductive coupling for ring closure and macrocyclization, as well as TPE-assisted modified Wurtz protocols.",named reactions_551.jpg
p500,500,YAMAGUCHI MACROLACTONIZATION,Importance; Mechanism,canonical_overview,"Overview page for the Yamaguchi macrolactonization describing conversion of hydroxy acids into medium- and large-ring lactones through mixed anhydride formation with 2,4,6-trichlorobenzoyl chloride and high-dilution DMAP-promoted cyclization.",Yamaguchi Macrolactonization,Yamaguchi Macrolactonization,"Highlights mixed anhydride generation, slow addition under high dilution, and DMAP-mediated intramolecular acyl transfer as the basis for efficient macrocycle formation.",named reactions_552.jpg
p501,501,YAMAGUCHI MACROLACTONIZATION,Synthetic Applications,application_example,"Application page for the Yamaguchi macrolactonization featuring macrolactin A, oleandolide, and laulimalide syntheses, where high-dilution mixed-anhydride cyclization efficiently closes 14- to 24-membered lactones in advanced polyketide settings.",Yamaguchi Macrolactonization,Yamaguchi Macrolactonization,"Examples show standard and modified Yamaguchi protocols, conformational effects on ring closure, and downstream manipulations such as Lindlar reduction, Sharpless epoxidation, and PMB deprotection.",named reactions_553.jpg
