family_name,family_class,transformation_type,mechanism_type,reactant_pattern_text,product_pattern_text,key_reagents_clue,common_solvents,common_conditions,synonym_names,description_short,overview_count,application_count,mechanism_count
Tishchenko Reaction,named_reaction,aldehyde disproportionation to ester,metal alkoxide hydride transfer,aldehyde or two aldehydes under catalyst,ester or monoester product,Tishchenko|aldehyde|ester|alkoxide|Evans-Tishchenko,THF|MeOH|CH2Cl2,"metal alkoxide or Lewis acidic catalyst, often aldehyde dimerization or crossed coupling",crossed Tishchenko reaction|Evans-Tishchenko reaction|aldol-Tishchenko reaction,"Hydride-transfer coupling of aldehydes to esters or 1,3-diol monoesters under metal alkoxide or related catalysis.",1,1,1
Tsuji-Trost Reaction / Allylation,named_reaction,allylic substitution via π-allylpalladium,oxidative addition to allyl precursor followed by nucleophilic substitution,allylic substrate + nucleophile,substituted allylation product,Tsuji-Trost|allylation|π-allylpalladium|allyl carbonate|Pd,THF|DMF|dioxane,"Pd catalyst, often phosphine ligand, soft or hard nucleophile control",Tsuji-Trost allylation|Tsuji-Trost reaction,Palladium-catalyzed allylic substitution proceeding through π-allylpalladium intermediates with rich nucleophile-dependent regio- and stereocontrol.,1,1,1
Tsuji-Wilkinson Decarbonylation Reaction,named_reaction,deformylation / decarbonylation of aldehydes or acyl derivatives,Rh-mediated oxidative addition and CO extrusion,aldehyde or acyl halide + Wilkinson catalyst,decarbonylated hydrocarbon or halide,Tsuji-Wilkinson|decarbonylation|RhCl(PPh3)3|Wilkinson catalyst|deformylation,benzene|toluene|PhCN|DCM,Wilkinson catalyst at room temperature to reflux,Wilkinson decarbonylation|Tsuji-Wilkinson decarbonylation,Rhodium-catalyzed removal of carbon monoxide from aldehydes and acyl derivatives to furnish decarbonylated products.,1,1,1
Ugi Multicomponent Reaction,named_reaction,four-component assembly of α-acylamino amides and variants,imine formation / isocyanide capture / acyl transfer,amine + carbonyl + isocyanide + acid or related nucleophile,α-acylamino carboxamide or heterocycle,Ugi|isocyanide|four-component|α-acylamino amide|multicomponent,MeOH|EtOH|CH2Cl2|THF,mild multicomponent condensation often at 0 °C to room temperature,Ugi four-component reaction|U-4CR,"Four-component condensation of amines, carbonyl compounds, isocyanides, and acidic components to access peptide-like adducts and heterocycles.",1,1,1
Ullmann Biaryl Ether and Biaryl Amine Synthesis / Condensation,named_reaction,Cu-mediated aryl O- or N-coupling,copper-mediated aryl substitution / coupling,aryl halide + phenol or arylamine,biaryl ether or diarylamine,Ullmann|CuI|Cu2O|biaryl ether|diarylamine,DMF|pyridine|DMSO|dioxane,"copper salts with base, often elevated temperature",Ullmann condensation|Ullmann biaryl ether synthesis|Ullmann biaryl amine synthesis,Copper-mediated coupling of aryl halides with phenols or amines to form biaryl ethers and diarylamines.,1,1,1
