family_name,family_class,transformation_type,mechanism_type,reactant_pattern_text,product_pattern_text,key_reagents_clue,common_solvents,common_conditions,synonym_names,description_short,overview_count,application_count,mechanism_count
Passerini Multicomponent Reaction,named_reaction,"three-component coupling of carboxylic acid, carbonyl compound, and isocyanide to α-acyloxycarboxamides or related adducts",multicomponent addition followed by intramolecular acyl transfer from a nitrilium/carboxylate-derived intermediate,carboxylic acid + aldehyde or ketone + isocyanide,"α-acyloxycarboxamide, α-hydroxycarboxamide, or α-hydroxylalkyltetrazole derivative",isocyanide|carboxylic acid|aldehyde|ketone|Passerini|hydrazoic acid,apolar solvent|CH2Cl2|MeOH|water,"typically run under mild one-pot conditions that combine an acid, a carbonyl partner, and an isocyanide; variants use water or HN3 to redirect product class",Passerini reaction|Passerini three-component reaction|Passerini 3-component reaction,"Classical isocyanide-based multicomponent reaction that rapidly assembles α-acyloxycarboxamides from simple acids, carbonyl compounds, and isocyanides.",1,1,1
Paternò-Büchi Reaction,named_reaction,photochemical [2+2] cycloaddition of a carbonyl compound with an alkene to form an oxetane,"UV-induced carbonyl excitation followed by 1,4-biradical formation and closure to oxetane",aldehyde or ketone + alkene,oxetane,UV light|hν|aldehyde|ketone|alkene|oxetane,CH3CN|ether|benzene|EtOAc,irradiation with UV light or sunlight; regioselectivity depends on substitution and stabilization of the intermediate biradical,Paterno-Büchi reaction|Paternò-Büchi cycloaddition,Photochemical carbonyl–alkene cycloaddition that furnishes oxetanes and is widely used in mechanistic photochemistry and natural-product synthesis.,1,1,1
Pauson-Khand Reaction,named_reaction,"formal [2+2+1] cycloaddition of alkyne, alkene, and carbon monoxide to cyclopentenones",cobalt-alkyne complex mediated carbonylative cyclization with alkene coordination and CO insertion,alkyne + alkene + CO or enyne-alkyne cobalt complex,substituted cyclopentenone,Co2(CO)8|CO|NMO|TMANO|enyne|cyclopentenone,toluene|CH2Cl2|THF,typically employs dicobalt-alkyne complexes under heat or promoter-assisted conditions; intra- and intermolecular variants are common,P-K reaction|modified Pauson-Khand reaction,Carbonylative cyclization that converts alkyne/alkene combinations into cyclopentenones and serves as a staple annulation in target-oriented synthesis.,1,1,1
Payne Rearrangement,named_reaction,"base-catalyzed migration of a 2,3-epoxy alcohol to an isomeric epoxide; aza/thia variants form aziridino or thiirano alcohols",alkoxide-initiated intramolecular nucleophilic epoxide opening and reclosure via 3-exo-tet displacement,"2,3-epoxy alcohol, amino alcohol, or thioacetate-derived epoxy alcohol","isomeric 2,3-epoxy alcohol, aziridino alcohol, or thiirano alcohol",base|NaOH|KOH|NaH|Lewis acid|aza-Payne|thia-Payne,MeOH|H2O|DMF|THF,"catalytic or stoichiometric base generates an alkoxide that opens and recloses the epoxide; product distribution depends on substrate, solvent, and nucleophile trapping",aza-Payne rearrangement|thia-Payne rearrangement|homo-Payne rearrangement,Epoxide migration manifold that relays stereochemistry and functional handles across epoxy alcohols and related heteroatom-substituted systems.,1,1,1
Perkin Reaction,named_reaction,"base-promoted condensation of aromatic aldehydes with acid anhydrides or azlactone precursors to α,β-unsaturated acids or azlactones","anhydride or azlactone enolization, carbonyl addition, and elimination to the conjugated product",aromatic aldehyde + acid anhydride or N-acyl glycine derivative,"α,β-unsaturated carboxylic acid, azlactone, or α-arylcinnamic acid derivative",Ac2O|NaOAc|Et3N|pyridine|hippuric acid|azlactone,acetic anhydride|pyridine|Ac2O,"best with aromatic aldehydes; weak base and heating promote condensation, while azlactone and mixed-anhydride variants broaden substrate classes",Perkin condensation|Erlenmeyer-Plöchl azlactone synthesis|Oglialoro modification,Classical olefination manifold that converts aromatic aldehydes into cinnamic-acid-type products or azlactone intermediates using anhydride-based carbon nucleophiles.,1,1,1
