page_label,page_no,title,section_name,page_kind,reference_family_name,family_names,summary,notes,image_filename
p224,224,JAPP-KLINGEMANN REACTION,Importance; Mechanism,canonical_overview,Japp-Klingemann Reaction,Japp-Klingemann Reaction|Modified Japp-Klingemann Reaction,"Overview page for the Japp-Klingemann reaction describing diazonium-salt coupling with 1,3-dicarbonyl compounds to furnish arylhydrazones through azo intermediates that collapse under acidic or basic conditions.","Key concepts: diazotization of anilines, coupling of arenediazonium salts with active methylene compounds, decarboxylative rearrangement of azo intermediates, and use of arylhydrazones as precursors for Fischer indole synthesis.",named reactions_276.jpg
p225,225,JAPP-KLINGEMANN REACTION,Synthetic Applications,application_example,Japp-Klingemann Reaction,Japp-Klingemann Reaction|Modified Japp-Klingemann Reaction,"Application page for the Japp-Klingemann reaction featuring (-)-gilbertine, arnoamine A, soraphen A degradation fragments, and a benzoxepinoindolone ring system assembled from hydrazone intermediates followed by Fischer indole or related cyclizations.","Examples emphasize buffered diazonium coupling, tetrafluoroborate or diazonium chloride partners, mild cleavage of macrocyclic beta-keto esters, and heterocycle formation from Japp-Klingemann-derived phenylhydrazones.",named reactions_277.jpg
p226,226,JOHNSON-CLAISEN REARRANGEMENT,Importance; Mechanism,canonical_overview,Johnson-Claisen Rearrangement,Johnson-Claisen Rearrangement|Johnson Claisen Rearrangement,"Overview page for the Johnson-Claisen rearrangement describing heating allylic alcohols with trialkyl orthoacetates under weakly acidic conditions to generate ketene acetals that undergo a [3,3]-sigmatropic shift to gamma,delta-unsaturated esters.","Key concepts: exchange of allylic alcohols with ortho esters, ketene acetal formation, Claisen-type rearrangement under thermal or clay/microwave activation, and diastereocontrol explained by chairlike transition states with 1,3-diaxial interactions.",named reactions_278.jpg
p227,227,JOHNSON-CLAISEN REARRANGEMENT,Synthetic Applications,application_example,Johnson-Claisen Rearrangement,Johnson-Claisen Rearrangement|Johnson Claisen Rearrangement,"Application page for the Johnson-Claisen rearrangement featuring halomon, (+)-merrilactone A, (+)-brefeldin A, and (+)-gelsemine intermediates prepared through allylic alcohol rearrangement to gamma,delta-unsaturated esters.","Examples emphasize trans-dichloroallyl alcohols, catalytic pivalic acid or p-toluenesulfonic acid activation, mesitylene or triethyl orthoacetate conditions, and installation of quaternary or tertiary chlorinated stereocenters in complex targets.",named reactions_279.jpg
p228,228,JONES OXIDATION / OXIDATION OF ALCOHOLS BY CHROMIUM REAGENTS,Importance; Mechanism,canonical_overview,Jones Oxidation,Jones Oxidation|Jones Reagent Oxidation|Sarett Oxidation|Collins Oxidation|PCC Oxidation|PDC Oxidation,"Overview page for the Jones oxidation describing chromium trioxide or dichromate in aqueous sulfuric acid/acetone and related chromium(VI) reagents that oxidize primary and secondary alcohols to aldehydes, ketones, or carboxylic acids.","Key concepts: chromate ester formation, Jones reagent conditions, overoxidation of primary alcohols, adaptation to Sarett/Collins oxidations in nonaqueous media, and comparison with PCC or PDC for milder oxidation of alcohols and oximes.",named reactions_280.jpg
p229,229,JONES OXIDATION / OXIDATION OF ALCOHOLS BY CHROMIUM REAGENTS,Synthetic Applications,application_example,Jones Oxidation,Jones Oxidation|Jones Reagent Oxidation|Sarett Oxidation|Collins Oxidation|PCC Oxidation|PDC Oxidation,"Application page for chromium-reagent oxidations featuring (-)-CP-263,114 (Phomoidride B), (+)-bilobalide, (-)-dendrobine, and (-)-solanapyron E constructed through Jones oxidation of alcohols or acetal motifs in late-stage settings.","Examples emphasize oxidation of secondary alcohols in fully elaborated natural product frameworks, tandem Jones/DMDO sequences, azidoketone formation, and oxidative unmasking of polyoxygenated bicyclic aldehyde precursors.",named reactions_281.jpg
p230,230,JULIA-LYTHGOE OLEFINATION,Importance; Mechanism,canonical_overview,Julia-Lythgoe Olefination,Julia-Lythgoe Olefination|Julia Olefination|Kocienski-Modified Julia Olefination,"Overview page for the Julia-Lythgoe olefination describing the addition of alpha-metallated phenyl sulfones to aldehydes or ketones, acylation of the resulting beta-alkoxysulfones, and reductive fragmentation to predominantly (E)-alkenes.","Key concepts: classical multi-step Julia-Lythgoe sequence, one-pot heteroaryl sulfone variants, Smiles-type rearrangement of benzothiazolyl sulfones, Na(Hg) or SmI2 mediated reductive elimination, and Kocienski-modified selectivity trends.",named reactions_282.jpg
p231,231,JULIA-LYTHGOE OLEFINATION,Synthetic Applications,application_example,Julia-Lythgoe Olefination,Julia-Lythgoe Olefination|Julia Olefination|Kocienski-Modified Julia Olefination,"Application page for the Julia-Lythgoe olefination featuring (+/-)-indolizomycin, (-)-callystatin A, and (+)-ambruticin synthesized through classical or Kocienski-modified sulfone olefination sequences to install polyene side chains.","Examples emphasize E,E,E-triene formation from epimeric acetoxy sulfones, HMPA-accelerated PT-sulfone eliminations, high E-selectivity from PT-sulfones, and base/solvent-dependent control of E/Z geometry in complex fragments.",named reactions_283.jpg
p232,232,KAGAN-MOLANDER SAMARIUM DIIODIDE-MEDIATED COUPLING,Importance; Mechanism,canonical_overview,Kagan-Molander Samarium Diiodide-Mediated Coupling,Kagan-Molander Samarium Diiodide-Mediated Coupling|Kagan-Molander SmI2 Coupling|Samarium Diiodide-Mediated Coupling,"Overview page for Kagan-Molander samarium diiodide-mediated coupling describing intermolecular and intramolecular SmI2-promoted reactions of alkyl halides or tosylates with aldehydes and ketones, together with acyl substitutions and tandem couplings to cyclic ketones or bicyclic alcohols.","Key concepts: samarium Grignard and samarium Barbier manifolds, HMPA or DMPU co-solvent acceleration, NiI2/Fe(DBM)3/copper additives, nucleophilic acyl substitution of halo esters, and tandem coupling sequences that generate complex polycycles.",named reactions_284.jpg
p233,233,KAGAN-MOLANDER SAMARIUM DIIODIDE-MEDIATED COUPLING,Synthetic Applications,application_example,Kagan-Molander Samarium Diiodide-Mediated Coupling,Kagan-Molander Samarium Diiodide-Mediated Coupling|Kagan-Molander SmI2 Coupling|Samarium Diiodide-Mediated Coupling,"Application page for Kagan-Molander samarium diiodide-mediated coupling featuring variecolin, vinigrol, a trans-fused tetracyclic ether ring system, and pederin assembled through SmI2-mediated Barbier, Reformatsky, or intramolecular acyl-substitution manifolds.","Examples emphasize two-step alcohol oxidation/lactone formation followed by SmI2 cyclization, HMPA-assisted rapid ring closure, intramolecular acyl substitution to tetrahydropyran-containing systems, and Reformatsky-type lactone construction in highly functionalized natural products.",named reactions_285.jpg
