family_name,family_class,transformation_type,mechanism_type,reactant_pattern_text,product_pattern_text,key_reagents_clue,common_solvents,common_conditions,synonym_names,description_short,overview_count,application_count,mechanism_count
Petasis Boronic Acid-Mannich Reaction,named_reaction,multicomponent amine alkylation using a boronic acid nucleophile and carbonyl-derived iminium ion,iminium formation followed by boronate ate-complex generation and vinyl/aryl transfer,amine + aldehyde or ketone + boronic acid or boronate,"allylic amine, benzylic amine, or amino alcohol derivative",boronic acid|vinylboronic acid|Petasis|formaldehyde|amine,toluene|dioxane|CH2Cl2|MeOH|EtOH,"often preforms an iminium from the amine and carbonyl partner, then adds the boronic acid under mild heating or room-temperature conditions",Petasis reaction|Petasis borono-Mannich reaction,"Boronic-acid-mediated Mannich variant that joins amines, carbonyl compounds, and organoboron nucleophiles to make allylic or benzylic amines under mild conditions.",1,1,1
Petasis-Ferrier Rearrangement,named_reaction,Lewis-acid-promoted rearrangement of enol acetals to substituted tetrahydrofurans or tetrahydropyrans,stepwise oxocarbenium rearrangement followed by intramolecular aluminum-mediated reduction,"five- or six-membered enol acetal derived from 1,3-dioxolan-4-one or 1,3-dioxane-4-one",substituted tetrahydrofuran or tetrahydropyran,Cp2TiMe2|Me2AlCl|i-Bu3Al|Petasis-Ferrier,THF|PhMe|DCM,"enol acetal generation is followed by Lewis-acid-mediated rearrangement, often using organoaluminum reagents to control stereochemistry and carbonyl transposition",modified Petasis-Ferrier rearrangement,Rearrangement manifold that converts cyclic enol acetals into highly substituted oxygen heterocycles and is especially useful for tetrahydropyran construction in polyketide synthesis.,1,1,1
Peterson Olefination,named_reaction,olefination of carbonyl compounds via α-silyl carbanions and β-hydroxysilane elimination,nucleophilic addition to carbonyl followed by acid- or base-triggered stereospecific elimination,α-silyl carbanion + aldehyde or ketone,alkene or enyne after elimination from β-hydroxysilane,trimethylsilyl|β-hydroxysilane|Peterson|TMS,THF|ether|toluene,"requires formation of a β-hydroxysilane intermediate, with acid and base conditions often giving complementary alkene geometries",Peterson reaction,Silicon-based olefination method that turns carbonyl compounds into alkenes through β-hydroxysilane intermediates with condition-dependent E/Z control.,1,1,1
Pfitzner-Moffatt Oxidation,named_reaction,activated-DMSO oxidation of primary or secondary alcohols to carbonyl compounds,acid-activated carbodiimide/DMSO pathway via alkoxysulfonium ylide formation and decomposition,1° or 2° alcohol + DMSO + carbodiimide + catalytic acid,aldehyde or ketone,DMSO|DCC|Moffatt|Pfitzner|TFAA|pyr-HCl,DMSO|benzene|EtOAc|DMF,"mild weakly acidic oxidation conditions that often use DCC and catalytic acid, with variants including Albright-Goldman, Parikh-Doering, and Swern conditions",Moffatt oxidation|P-M oxidation,Classical activated-DMSO oxidation that converts alcohols to aldehydes or ketones under mild conditions using carbodiimides and catalytic acid.,1,1,1
Pictet-Spengler Tetrahydroisoquinoline Synthesis,named_reaction,acid-promoted cyclocondensation of β-arylethylamines with carbonyl compounds to tetrahydroisoquinolines,Schiff-base or iminium formation followed by intramolecular electrophilic aromatic substitution and deprotonation,β-arylethylamine + aldehyde or ketone,substituted tetrahydroisoquinoline,Pictet-Spengler|β-arylethylamine|iminium|tetrahydroisoquinoline,protic media|TFA|HCl|BF3·OEt2|silica gel,"typically relies on acid-promoted iminium generation and cyclization of an electron-rich aryl or heteroaryl ring, sometimes from acetal surrogates",Pictet-Spengler reaction|Pictet-Spengler tetrahydroisoquinoline synthesis|oxa-Pictet-Spengler reaction,Foundational alkaloid-forming cyclization that converts β-arylethylamines and carbonyl partners into tetrahydroisoquinoline frameworks through iminium capture.,1,1,1
